species_name,输出物种名,中文名,生活型,株,茎,枝,叶,果,种子,国内产地,特有性,生境,海拔
Abies squamata,Abies squamata Mast.,鳞皮冷杉,乔木；,高达40米；,树皮深纵裂，成长方块片固着于树干；,四年生以上小枝枝皮裂成不规则鳞状薄片脱落，内皮红色，一年生枝褐色，被密毛或近无毛；,叶长1.5-3厘米，宽约2亳米，先端尖或钝，稀微凹，上面中部以上或近先端有时具3-15条不完整的气孔线，微有白粉，下面有两条气孔带；树脂道2，中生，幼树之叶近边生；,球果短圆柱形或长卵圆形，长5-8厘米，径2.5-3.5厘米，熟时黑色，近无梗；中部种麟近肾形，长1.1-1.4毫米，宽1.4-1.8毫米；苞鳞具长尖，上端或仅尖头露出；,种子长约5毫米，翅与种子近等长；,四川西部甘孜藏族自治州（康定以西、金沙江流域以东、道孚以南、九龙、稻城、乡城、得荣以北）及北部阿坝藏族自治州（绰斯甲及马尔康等地）及青海南部与西藏东南部的高山上部；,为我国特有树种；,气候干冷，年降水量约700毫m，土壤为棕色灰化土地带，组成大面积纯林，或与川西云杉、红杉等组成 混交林；,3500-4000m；
Abies ferreana,Abies ferreana Borderes et Gaussen,中甸冷杉,乔木；,高达20米；,树皮灰褐或灰黑色，鳞状纵裂；,小枝密被诱褐或暗褐色柔毛，一年生枝红褐或暗褐色，二至三年生暗褐色或黑褐色；,叶长1-2.3厘米，宽2-2.5毫米，先端钝有凹缺，稀主枝之叶先端钝或有短尖头，上面无气孔线，下面有两条粉白色气孔带，树脂道2，中生；,球果短圆柱形或卵状圆柱形，长约7厘米，径3.5-4厘米，熟时紫黑或蓝黑色，无梗;中部种鳞扇状四边形，长1.6-2厘米，宽1.6-2.2厘米；苞鳞露出，常反曲；,种子长0.7-1厘米，连翅长1.4-1.8厘米；,产于云南西北部（中甸、维西及澜沧江怒江分水岭）、四川西南部（木里）；,为我国特有种；,高山地带；,3300-3800m；
Abies fargesii,Abies fargesii Franch.,巴山冷杉,乔木；,高达40米；,树皮暗灰或暗灰褐色，块状开裂；,一年生枝红褐色或微带紫色，无毛；,叶长(1-)1.7-2.2(-3)厘米，宽1.5-4毫米，上部较下部宽，先端钝，有四缺，稀尖，上面无气孔线，下面有两条白色气孔带；树脂道2，中生；,球果圆柱状长圆形或圆柱形，长5-8厘米，径3-4厘米，熟时紫黑色；中部种鳞肾形或扇状肾形，长0.8-1.2厘米，宽1.5-2厘米，上部宽厚，边缘内曲；苞鳞倒卵状楔形，先端有急尖的短尖头，露出或微露出；,种子倒三角状卵圆形，翅楔形，较种子为短或等长；,产河南西部、湖北西部及西北部、四川东北部、陕西南部、甘肃南部及东南部；,为我国特有树种；,NA,1500-3700m；
Abies chayuensis,Abies chayuensis Cheng et L. K. Fu,察隅冷杉,乔木；,高30米；,NA,小枝上有微隆起的叶枕，叶枕之间有凹槽，主枝无毛或有疏毛，侧枝有毛，通常凹槽内较密，一、二年生枝淡褐灰色；,叶在枝条下面排列成两列，枝条上面的叶斜展至近直立，条形，通常微弯，长1.5-2.5厘米，宽约3毫米，边缘微反曲，先端钝或微凹，基部渐窄，上面中脉凹下，下面中脉隆起，两侧有白粉气孔带; 横切面有2个中生树脂道， 皮下细胞二层，外层连续排列，内层间断排列；,幼果紫色，直立，圆柱形，两端微渐窄，顶端钝；苞鳞的顶端宽圆，边缘有缺齿，中央有急尖的尾状长尖头，尖头长约5毫米；,NA,产于西藏东南部察隅（模式标本产地）；,NA,上下之向阳山坡；,3800m；
Abies firma,Abies firma Siebold et Zuccarini,日本冷杉,乔木，在原产地高达50米，胸径2米；树皮暗灰或暗灰褐色，鳞状开裂；粗糙；,在原产地高达50米，胸径2米；,树皮暗灰或暗灰褐色，鳞状开裂；,一年生枝淡黄灰色，凹槽中有细毛；,叶长2-3.5(-5)厘米，宽3-4毫米，树脂道2，中生，或4(2个中生、2年边生)，幼树之叶常为2个边生树脂道；,球果圆柱形，长10-15厘米，熟前黄绿色，熟时淡褐色；种鳞扇状四边形；苞鳞外露，直伸，先端有急尖头；,种子具较长的翅；,我国辽宁旅顺、山东青岛、江苏南京、浙江莫干山、江西庐山及台湾等地种栽培作庭园树，生长良好；,NA,NA,NA
Abies chensiensis,Abies chensiensis Tiegh.,秦岭冷杉,乔木；,高达50米；一年生枝淡黄灰色、淡黄色或淡褐黄色，无毛或凹槽中有稀疏细毛，二、三年生枝淡黄灰色或灰色；冬芽圆锥形，有树脂；,NA,NA,叶在枝上列成两列或近两列状，条形，长1.5-4.8厘米，上面深绿色，下面有2条白色气孔带；果枝之叶先端尖．或钝， 树脂道中生或近中生，营养枝及幼树的叶较长，先端二裂或微凹，树脂管边生；横切面上面至下面两侧边缘有皮下细胞一层，连续或不连续排列，下面中部一至二层，二层者内层不连续排列；,球果圆柱形或卵状圆柱形，长7-11厘米，径3-4厘米，近无梗，成熟前绿色，熟时褐色，中部种鳞肾形， 长约1.5厘米，宽约2.5厘米，鳞背露出部分密生短毛；苞鳞长约种鳞的3/4，不外露，上部近圆形，边缘有细缺齿，中央有短急尖头，中下部近等宽，基部渐窄；种子较种翅为长，倒三角状椭圆形，长8毫米，种翅宽大，倒三角形，上部宽约1厘米，连同种子长约1.3厘米；,NA,产于陕西南部、湖北西部及甘肃南部；,为我国特有树种；,NA,2300-3000m；
Abies holophylla,Abies holophylla Maxim.,杉松,乔木；,高达30米，胸径1米；,幼树树皮淡褐色，不裂，老则灰褐或暗褐色，浅纵裂成条片状；,大枝平展；一年生枝淡黄灰或淡黄褐色，无毛，有光泽，二至三年生枝灰色、灰黄色或灰褐色；,叶长2-4厘米，宽1.5-2.5毫米，先端急尖或渐尖，无凹缺，果枝之叶上面中上部或近先端常有2-5条不整齐的气孔线；树脂道2，中生；,球果圆柱形，长6-14厘米，径3.5-4厘米，熟前绿色，熟时淡黄褐或淡褐色，近无梗；中部种鳞近扇形四边形或倒三角状扇形，上部宽圆，微厚，上部边缘内曲；苞鳞短，不露出；,种子倒三角形，长8-9毫米，种翅宽大，较种子为长；,产于我国东北牡丹江流域山区、长白山区及辽河东部山区，在；,NA,混生树种有：红松、臭冷杉、红皮云杉、长白鱼鳞云杉、黄花落叶松、大青杨、枫桦、春榆、裂叶榆、山杨、糠椴， 黄檗．胡桃楸及水曲柳等；,500-1200m；
